[{"mean":56.156273733333336,"time":"00:00:50","timePerReceive":"3,350.73","java":"25.0.5","runner":"montagne-v6","nbRays":1155,"nbProfiles":1061.0,"timePerProfiles":47.37134778510839,"nNan":0,"silenceThreshold":-89.0,"timePerRays":43.516017316,"histogram":{"<35":0,"35-40":3,"40-45":0,"45-50":3,"50-55":2,"55-60":1,"60-65":3,"65-70":1,"70-75":0,"75-80":0,">80":2,"NaN":0},"campagne":"c1","scenario":"homogene","version":"v6.0.2-SNAPSHOT-pr1140-6008b09"}]