[{"mean":58.92323148635231,"time":"00:30:52","timePerReceive":"1,149.07","java":"25.0.5","runner":"v6-custom","nbRays":0.0,"nbProfiles":8659505.0,"timePerRays":0,"timePerProfiles":0.21390437444172616,"nNan":0,"silenceThreshold":-89.0,"histogram":{"<35":0,"35-40":0,"40-45":0,"45-50":22,"50-55":258,"55-60":723,"60-65":505,"65-70":96,"70-75":8,"75-80":0,">80":0,"NaN":0},"version":"v6.0.2-SNAPSHOT-pr1140-6008b09"}]