[{"mean":57.69119758667198,"time":"00:17:11","timePerReceive":"35.08","java":"25.0.4.1","runner":"v6-generic","nbRays":0.0,"nbProfiles":11308232.0,"timePerRays":0,"timePerProfiles":0.09122584326179371,"nNan":30,"silenceThreshold":-89.0,"histogram":{"<35":37,"35-40":267,"40-45":925,"45-50":1905,"50-55":6377,"55-60":9272,"60-65":7079,"65-70":2635,"70-75":681,"75-80":203,">80":0,"NaN":30},"version":"v6.0.2-SNAPSHOT-pr1003-df2cb77"}]